Keyword,LeftContext,RightContext
Pompeius,zweifelhaft sein daß Caesar das Volk und den demokratischen Fortschritt,die Aristokratie und die legitime Verfassung auf sein Panier schreiben
Pompeius,an dem Kampfe sich hätte bestimmen lassen Damit wäre auch,Rolle in dem bevorstehenden Kampf entschieden gewesen wenn nicht ohnehin
Pompeius,weder Parteihaupt noch General zu sein verstand ein Mann von,politischer und militärischer Bedeutung das Banner der bestehenden Verfassung erhob
Pompeius,haufenweise demselben zu um darunter zwar nicht für den König,aber doch gegen den König Caesar fechten zu helfen Hierzu
Pompeius,Hierzu kam ein anderes wenigstens ebenso wichtiges Moment Es war,Art selbst wenn er sich entschlossen hatte nicht den Weg
Pompeius,in der Gründung begriffene Monarchie den Krieg zu motivieren Nach,Absicht sollte während er selbst sich beiseite hielt und in
Pompeius,Caesar brechen ihm den Krieg erklären und mit dessen Führung,beauftragen der dann dem allgemeinen Verlangen nachgebend als Beschützer der
Pompeius,und wieder einmal das Vaterland zu retten gedachte Also gewann,durch die Allianz mit den Konservativen teils zu seiner persönlichen
Pompeius,vorläufig nur erst der eine aber bereits sehr ernste daß,es aus der Hand gab wann und wie es ihm
Pompeius,in der Koalition mit dem minder gefährlichen der Herrscher Wenn,sich zu der oligarchischen Verfassung bekannte und für sie gegen
Pompeius,im Bunde die furchtsame Majorität zur Kriegserklärung zwingen Daß es,mit seiner Verfassungstreue nicht voller Ernst war konnte zwar niemand
Pompeius,wie die Sache der Oligarchie stand war das Anerbieten des,mit ihr sich zu verbünden für sie die möglichst günstige
Pompeius,sie die möglichst günstige Fügung Der Abschluß der Allianz zwischen,und der Catonischen Partei erfolgte verhältnismäßig rasch Schon während Pompeius
Pompeius,Pompeius und der Catonischen Partei erfolgte verhältnismäßig rasch Schon während,Diktatur hatte beiderseits eine bemerkenswerte Annäherung stattgefunden Pompeius ganzes Verhalten
Pompeius,Schon während Pompeius Diktatur hatte beiderseits eine bemerkenswerte Annäherung stattgefunden,ganzes Verhalten in der Milonischen Krise seine schroffe Zurückweisung des
Pompeius,waren Andrerseits hatten auch Cato und seine Getreuen den Antrag,die Diktatur zu übertragen statt ihn mit gewohntem Rigorismus zu
Pompeius,gemacht zunächst aus den Händen des Bibulus und Cato hatte,das ungeteilte Konsulat empfangen Wenn so schon zu Anfang des
Pompeius,schon zu Anfang des J 702 die Catonische Partei und,wenigstens stillschweigend sich verstanden so durfte das Bündnis als förmlich
Pompeius,Rom Langsam und schwerfällig wie er pflegte aber unverwandt schritt,auf den Bruch zu In Caesars Absicht lag es dagegen
Pompeius,Caesars Absicht lag es dagegen nicht in diesem Augenblicke mit,sich zu überwerfen Zwar ernstlich und auf die Dauer konnte
Pompeius,teilen wollen am wenigsten mit einem so untergeordneter Art wie,war und ohne Zweifel war er längst entschlossen nach Beendigung
Pompeius,bis zum Winter 702 3 52 1 unausgesetzt beschäftigte wo,und die grundsätzlich ihm feindliche Verfassungspartei in Italien geboten Darum
Pompeius,Verfassungspartei in Italien geboten Darum suchte er das Verhältnis mit,und damit den Frieden aufrecht zu halten und wenn irgend
Pompeius,Spitze des Staates gestellt so konnte er der dem Staatsmann,noch weit entschiedener überlegen war als dem Feldherrn wohl darauf
Pompeius,zu annullieren zufrieden war die wiederholten Versuche Caesars sich mit,verschwägert zu halten mochten darauf abzielen eine solche Lösung anzubahnen
Pompeius,ließ Allerdings hing das Gelingen dieses Planes davon ab daß,gutmütig genug war jetzt noch Caesar zu dem ihm in
Pompeius,52 1 stieg die Zahl seiner Legionen einschließlich der von,entlehnten auf elf Aber zugleich billigte er ausdrücklich und öffentlich
Pompeius,entlehnten auf elf Aber zugleich billigte er ausdrücklich und öffentlich,Verhalten während der Diktatur und die durch ihn bewirkte Wiederherstellung
Pompeius,Cato längst bereit stand ihn peinlich zu belangen und da,ein mehr als zweifelhafter Beschützer war das Publikum guten Grund
Pompeius,allein das desfällige Dekret war noch nicht ergangen und da,jetzt im Besitz der Dekretiermaschine war hing Caesar in dieser
Pompeius,Hinsicht von dem guten Willen seines Nebenbuhlers ab Unbegreiflicherweise gab,diese vollkommen sichere Stellung freiwillig auf mit seiner Einwilligung und
Pompeius,rechtlich nur als eine Nullität angesehen werden konnte Was also,einfach hätte festhalten können hatte er vorgezogen erst zu verschenken
Pompeius,zu Die zehn Jahre auf welche zuletzt durch das von,selbst in Gemeinschaft mit Crassus beantragte Gesetz Caesar die Statthalterschaft
Pompeius,am 1 Jan 706 vielmehr am 1 März 705 herbeizuführen,kümmerliche Hinterhältigkeit und zögernde Tücke sind in diesen Veranstaltungen in
Pompeius,die Verfassung teils Caesar vor dem Tage wo die durch,eigenes Gesetz ihm zugesicherte Frist zu Ende lief also vom
Pompeius,damit den ersten Anlaß zu offener Kollision zwischen der von,vorgeschobenen Verfassungspartei und den Vertretern Caesars im Senat Der Konsul
Pompeius,sie wiesen ohne Zweifel darauf hin daß vor wenigen Jahren,ganz ebenso die spanischen Statthalterschaften mit dem Konsulat vereinigt habe
Pompeius,keiner beschlußfähigen Sitzung kommen und wieder andere Monate gingen über,feierlichem Zaudern verloren Endlich brach dieser das Schweigen und stellte
Pompeius,konnten die Kassation dieser Beschlüsse durch ihr tribunicisches Veto allein,sprach sehr bestimmt aus daß die Beamten verpflichtet seien dem
Pompeius,hierin nichts ändern würden Die oligarchische Partei zu deren Organ,jetzt sich machte verriet nicht undeutlich die Absicht nach einem
Pompeius,Angriffen sich irgendwie der Komitien zu bedienen Die Koalition zwischen,und der Verfassungspartei war also förmlich erklärt auch über Caesar
Pompeius,der Senatsmajorität die Hoffnung nicht auf sie ungeachtet des von,auf sie ausgeübten Druckes von der Kriegserklärung noch zurückzuhalten Selbst
Pompeius,zu geraten Als der Senat Frühling 704 auf Betrieb des,sowohl an diesen wie an Caesar das Ansuchen stellte je
Pompeius,bevorstehenden Parthischen Krieg abzugeben und als in Gemäßheit dieses Beschlusses,die vor mehreren Jahren an Caesar überlassene Legion von diesem
Pompeius,die Opportunität dieses Senatsbeschlusses noch die Berechtigung der Forderung des,sich bestreiten ließ und Caesar an der Einhaltung der Schranken
Pompeius,den Euphrat zu senden hielt diese sie in Capua für,in Bereitschaft und das Publikum hatte wieder einmal Gelegenheit Caesars
Pompeius,Republikaner gespielt und als solcher sowohl gegen Caesar wie gegen,gedonnert Die anscheinend unparteiische Stellung die dies ihm gab benutzte
Pompeius,Beschlusse vollständig beizupflichten aber die gleichzeitige Ausdehnung desselben auch auf,und dessen außerordentliche Kommandos zu verlangen Seine Auseinandersetzung daß ein
Pompeius,Zustand sich nur durch Beseitigung sämtlicher Ausnahmestellungen herbeiführen lasse daß,als nur vom Senat mit dem Prokonsulat betraut noch viel
Pompeius,und Kommando jeden Augenblick auf Anfordern des Senats niederzulegen wofern,das gleiche tue er durfte es denn ohne sein italisch
Pompeius,er durfte es denn ohne sein italisch spanisches Kommando war,nicht länger furchtbar Dagegen konnte Pompeius ebendeswegen nicht umhin sich
Pompeius,italisch spanisches Kommando war Pompeius nicht länger furchtbar Dagegen konnte,ebendeswegen nicht umhin sich zu weigern seine Erwiderung daß Caesar
Pompeius,für seinen Rücktritt ansetzte Wieder stockte Monate lang die Entscheidung,und die Catonianer die bedenkliche Stimmung der Senatsmajorität erkennend wagten
Pompeius,fand endlich statt und konstatierte die Niederlage der Partei des,und Cato in ihrem ganzen Umfang Mit 370 gegen 30
Pompeius,Bürger von Rom die frohe Botschaft von Curios rettender Tat,ward also vom Senat nicht minder abberufen als Caesar und
Pompeius,Caesar und während Caesar bereit stand dem Befehl nachzukommen verweigerte,geradezu den Gehorsam Der versitzende Konsul Gaius Marcellus des Marcus
Pompeius,ihr Fahrzeug auf den Sandbänken der schlaffen Majorität stranden Von,mußten ihre Führer in den Konferenzen die bittersten Vorwürfe hören
Pompeius,die Kurie den Antrag des Konsuls Gaius Marcellus darauf hin,Marschbefehl gegen Caesar zu erteilen mit Mehrheit verwarf so begab
Pompeius,für 705 erwählten gleichfalls zur Catonischen Partei gehörigen Konsuln zu,und diese drei Männer ersuchten kraft eigener Machtvollkommenheit den General
Pompeius,hatte keine Zeit mehr auf solche Nebensachen Rücksicht zu nehmen,nahm sie an Die Kriegsvorbereitungen die Aushebungen begannen um sie
Pompeius,Kriegsvorbereitungen die Aushebungen begannen um sie persönlich zu fördern verließ,im December 704 die Hauptstadt Caesar hatte es vollständig erreicht
Pompeius,Bürgerkrieges zuzuschieben Er hatte während er selber den Rechtsboden festhielt,gezwungen den Krieg zu erklären und ihn zu erklären nicht
Pompeius,zu betreiben In diesem Ultimatum ließ Caesar alle früheren an,gestellten Gegenforderungen fallen und erbot sich seinerseits bis zu der
Pompeius,ein mit denen zu Anfang der Verhandlungen die Senatspartei ja,selbst erklärt hatten sich befriedigen zu wollen und zeigte sich
Pompeius,diesen erstaunlichen Zugeständnissen Ernst war und er sein Spiel gegen,selbst bei solchem Vorgeben durchführen zu können sich getraute oder
Pompeius,ägyptischen und gallischen Feldzügen als glänzender Reiteroffizier und Quintus Cassius,ehemaliger Quästor welche beide jetzt an Curios Stelle Caesars Sache
Pompeius,denen Caesar den drohenden Bürgerkrieg den allgemeinen Wunsch nach Frieden,Übermut seine eigene Nachgiebigkeit mit der ganzen unwiderstehlichen Macht der
Pompeius,Furcht vor den zahlreich in die Hauptstadt geströmten Soldaten des,war die Gesinnung der Majorität nicht zweifelhaft man durfte nicht
Pompeius,den von Marcus Caelius Rufus und Marcus Calidius gestellten Antrag,zur sofortigen Abreise nach Spanien zu veranlassen weigerten sich die
Pompeius,Senat zu schützen vermöge durfte nicht zur Abstimmung gebracht werden,ließ durch sein gewöhnliches Organ Quintus Scipio erklären daß er
Pompeius,Sehen wir wie für die bevorstehende Kriegführung zwischen Caesar und,sich das Machtverhältnis gestellt hatte Caesars Macht ruhte zunächst auf
Pompeius,Beginn der Feindseligkeiten im J 705 statt in Caesars in,Hauptquartier und kämpfte während des ganzen Bürgerkrieges mit beispielloser Erbitterung
Pompeius,das des Lucullus auseinander zu sprengen selbst Labienus erschien in,Lager wohl mit einem Haufen keltischer und deutscher Reiter aber
Pompeius,Bewegung setzte allen formalen Rechtserörterungen zum Trotz in Cato und,die Verteidiger der legitimen Republik in Caesar den demokratischen Usurpator
Pompeius,ein treues Heer und eine ergebene Provinz so begann ihn,als tatsächliches Oberhaupt des römischen Gemeinwesens und im Vollbesitz aller
Pompeius,Notwendigkeit ergab war dem Wesen der Koalition zuwider und obwohl,zu sehr Soldat um sich über die Unentbehrlichkeit derselben zu
Pompeius,zwanzigjährigen auf beiden Seiten mit vergifteten Waffen geführten Krieg zwischen,und der Verfassungspartei das auf beiden Seiten lebhaft vorhandene und
Pompeius,alles Flottenmaterial standen zu ihrer Verfügung Die beiden Spanien gleichsam,Hausmacht so gut wie die beiden Gallien Caesars waren ihrem
Pompeius,und Kommandantenstellen während der letzten Jahre unter dem Einfluß von,und der Senatsminorität mit sicheren Männern besetzt worden Durchaus und
Pompeius,großer Entschiedenheit ergriffen die Klientelstaaten Partei gegen Caesar und für,Die bedeutendsten Fürsten und Städte waren in den verschiedenen Abschnitten
Pompeius,Städte waren in den verschiedenen Abschnitten seiner mannigfaltigen Wirksamkeit zu,in die engsten persönlichen Beziehungen getreten wie er denn in
Pompeius,Caesars eigener Provinz verdankte wohl auch diesem manche Vergünstigungen aber,vom Sertorianischen Kriege her eine sehr ansehnliche Gebietserweiterung und es
Pompeius,der Regel jede andere Rücksicht überwog Die Armee über die,verfügte bestand hauptsächlich in den spanischen Truppen sieben krieggewohnten und
Pompeius,einberufen werden Mit Einrechnung dieser stellte sich die Zahl der,im ganzen zur Verfügung stehenden Truppen ohne die sieben Legionen
Pompeius,gegen 60000 Mann sodaß es eben keine Übertreibung war wenn,behauptete nur mit dem Fuße stampfen zu dürfen um den
Pompeius,und beritten gemacht was indes so allgemeine Mißbilligung fand daß,diese Truppe wiederauflöste und dafür aus den berittenen Hirtensklaven Apuliens
Pompeius,der Chaussee etwa 50 deutsche Meilen von Rom entfernt war,zwei schwache Legionen 7000 Mann Infanterie und eine geringe Reiterschar
Pompeius,an der Saone und Loire zur Hälfte in Belgien während,italische Reserven bereits von allen Seiten in den Sammelplätzen eintrafen
Pompeius,Anfang des Kampfes bis zum Frühjahr sich hinauszog so ergriffen,spanische Truppen im Transalpinischen seine italischen im Cisalpinischen Gallien die
Pompeius,im Transalpinischen seine italischen im Cisalpinischen Gallien die Offensive und,als Taktiker Caesar gewachsen an Erfahrung ihm überlegen war in
Pompeius,Er wählte das letztere Die Konsternation der Gegenpartei war grenzenlos,erhielt die Meldung von Caesars Anmarsch in Rom er schien
Pompeius,daß sie nicht einmal die Kassen in Sicherheit brachten als,sie aufforderte dies nachzuholen wozu ausreichend Zeit war ließen sie
Pompeius,ward großer Kriegsrat in Teanum Sidicinum gehalten 23 Jan dem,Labienus und beide Konsuln beiwohnten Zunächst lagen wieder Vergleichsvorschläge Caesars
Pompeius,sich in regelrechter Weise um das Konsulat zu bewerben wofern,nach Spanien abgehe und Italien entwaffnet werde Die Antwort war
Pompeius,sich anheischig mache die Entwaffnung Italiens und die Abreise des,durch einen ordnungsmäßig in der Hauptstadt zu fassenden Senatsbeschluß herbeizuführen
Pompeius,das Gegenteil war Die von Caesar gewünschte persönliche Zusammenkunft mit,lehnte dieser ab und mußte sie ablehnen um nicht durch
Pompeius,Die Kriegführung anlangend einigte man in Teanum sich dahin daß,das Kommando der bei Luceria stehenden Truppen auf denen trotz
Pompeius,an ob die picenische Landschaft sich so lange hielt bis,zu ihrer Verteidigung herankam Bereits war Caesar mit seiner wiedervereinigten
Pompeius,3000 Mann Camerinum Publius Lentulus Spinther mit 5000 Asculum Die,ganz ergebenen Mannschaften ließen zum größten Teil Haus und Hof
Pompeius,schon verloren als der zur vorläufigen Leitung der Verteidigung von,gesandte Offizier Lucius Vibullius Rufus kein vornehmer Senator aber ein
Pompeius,Caesar noch mehrere Tagemärsche zurück es war nichts im Wege,Instruktionen gemäß sofort aufzubrechen und die geretteten picenischen nebst den
Pompeius,Starrköpfe der römischen Aristokratie und dieser weigerte sich nicht bloß,Befehlen Folge zu leisten sondern verhinderte auch den Vibullius wenigstens
Pompeius,nach Apulien abzurücken So fest hielt er sich überzeugt daß,nur aus Eigensinn zaudere und notwendig zum Entsatz herbeikommen müsse
Pompeius,die in die umliegenden Städte verlegten Rekrutenhaufen in Corfinium zusammenzog,aber erschien nicht und aus guten Gründen denn seine beiden
Pompeius,40000 Mann zur Hälfte gedienter Leute stand Solange Domitius auf,Eintreffen hoffte ließ er die Stadt verteidigen als dessen Briefe
Pompeius,von 3500 Mann war bereits früher genötigt worden zu kapitulieren,hatte Italien verloren gegeben sowie Caesar Picenum eingenommen hatte nur
Pompeius,gesetzt Hier fanden die beiden Legionen von Luceria und was,in dem menschenleeren Apulien an Rekruten in der Eile hatte
Pompeius,4 März mit der kleineren von etwa 10000 Mann erwartete,in Brundisium die Rückkehr der Flotte denn wie wünschenswert für
Pompeius,schwimmende Brücken zu schließen um die rückkehrende Flotte auszusperren allein,ließ die im Hafen liegenden Handelsfahrzeuge armieren und wußte die
Pompeius,lange zu verhindern bis die Flotte erschien und die von,trotz der Wachsamkeit der Belagerer und der feindlichen Gesinnung der
Pompeius,allgemein Feinde und Freunde sahen in Caesar einen zweiten Catilina,glaubte oder behauptete zu glauben daß Caesar nur durch die
Pompeius,bis Brundisium unablässig die Versuche erneuert eine persönliche Zusammenkunft mit,und einen erträglichen Vergleich einzuleiten Aber wenn die Aristokratie schon
Pompeius,einflußreichen Senatsmitgliedern nur wenige darunter war trotz der Befehle des,und der Konsuln in Italien zum Teil sogar in der
Pompeius,Als dann Caesar den Senat ersuchte wenigstens seine Friedensvorschläge an,zu übermitteln war man dem an sich zwar nicht entgegen
Pompeius,derselben Schlaffheit des hohen Kollegiums durch die kurz zuvor Caesar,legale Ernennung zum Oberfeldherrn in dem Bürgerkrieg vereitelt hatte scheiterte
Pompeius,Gallien offensiv zu führen durch Caesars Angriff vereitelt war hatte,nach Spanien zu gehen beabsichtigt Hier hatte er eine sehr
Pompeius,zählte sieben Legionen es dienten darin eine große Anzahl von,Veteranen und die mehrjährigen Kämpfe in den lusitanischen Bergen hatten
Pompeius,Kommando geführt und nach dessen Beendigung sie neu eingerichtet hatte,konnte nach der italischen Katastrophe offenbar nichts Besseres tun als
Pompeius,sich den spanischen Truppen und der spanischen Bevölkerung anzuvertrauen genug,blieb im Osten und Caesar hatte die Wahl den nächsten
Pompeius,entweder gegen die Armee zu richten die in Griechenland unter,eigenem Befehl sich organisierte oder gegen die schlagfertige seiner Unterfeldherren
Pompeius,sowie Caesar ihn freigegeben sich mit seinem Gesinde und mit,Vertrauensmann Lucius Vibullius Rufus nach Massalia auf den Weg gemacht
Pompeius,gemacht und in der Tat die Stadt bestimmt sich für,zu erklären ja Caesars Truppen den Durchmarsch zu weigern Von
Pompeius,unter Afranius und Petreius den durch Vibullius überbrachten Befehlen des,gemäß sich aufgemacht um die Pyrenäen dem Feinde zu sperren
Pompeius,seine Armee eingereiht hatte ehrte er diese alten Legionare des,durch die Zusage daß keiner wider seinen Willen genötigt werden
Pompeius,die Gewalt des Siegers Im jenseitigen wo Marcus Varro für,den Oberbefehl führte schien es diesem als er die Katastrophe
Pompeius,Element und sie durften hoffen auf diesem kräftige Unterstützung von,zu empfangen welcher ja das Meer ausschließlich beherrschte Indes Caesars
Pompeius,rasch verfallende Generation Inwiefern diese Kriegsvorgänge des Jahres 705 in,allgemeinen Feldzugsplan eingriffen namentlich welche Rolle in diesem nach dem
Pompeius,im Westen zugeteilt war läßt sich nur vermutungsweise bestimmen Daß,die Absicht gehabt seinem in Spanien fechtenden Heer zu Lande
Pompeius,für die bevorstehende Überfahrt nach Griechenland mitverwandt werden sollten Falls,versuchen würde zu Lande in Italien einzudringen hatten Marcus Licinius
Pompeius,zwischen dieser Insel und dem Festland Das letztere Geschwader griffen,Flottenführer im Adriatischen Meer Marcus Octavius mit der griechischen Lucius
Pompeius,Inselstadt Issa Lissa und andere Ortschaften ergriffen die Partei des,allein die Anhänger Caesars behaupteten sich in Salonae Spalato und
Pompeius,erscheint er wenn man erwägt daß die Verrichtungen der unter,Oberbefehl stehenden Land und Seemacht während des ganzen ereignisreichen Jahres
Pompeius,Afrika war dort vollständig hier wenigstens teilweise gelungen dagegen ward,Plan Italien auszuhungern durch die Wegnahme Siciliens in der Hauptsache
Pompeius,große Sammelplatz der Gegner Caesars ward Makedonien Dorthin begab sich,selbst und die Masse der brundisinischen Emigranten dorthin die übrigen
Pompeius,alles Ernstes den Vorschlag diejenigen Senatoren die im Heer des,gefochten hätten über alle die entweder neutral geblieben oder zwar
Pompeius,des Vermögens zu bestrafen Ein anderer dieser Ultras erhob bei,gegen Lucius Afranius wegen seiner mangelhaften Verteidigung Spaniens eine förmliche
Pompeius,an sie haßten denn auch die laueren Parteigenossen und den,mit seinem persönlichen Anhang wo möglich noch mehr als die
Pompeius,im Pompeianischen Lager waren in Verzweiflung über dies rasende Treiben,selbst ein tapferer Soldat schonte soweit er durfte und konnte
Pompeius,Vorbereitungen im makedonischen Lager lag in der Hand des Oberfeldherrn,Die stets schwierige und gedrückte Stellung desselben hatte durch die
Pompeius,Lentulus und des Lucius Domitius von dem Augenblick an wo,an die Spitze der Armee getreten war hatte er sie
Pompeius,es entschied allein der Erfolg Im Vertrauen auf den Feldherrn,hatte die Verfassungspartei mit Caesar gebrochen die verderblichen Folgen dieses
Pompeius,gebrochen die verderblichen Folgen dieses Bruches fielen auf den Feldherrn,zurück und wenn auch bei der notorischen militärischen Unfähigkeit aller
Pompeius,die der vornehmen Generale die mit ebenso gutem Fug wie,sich Prokonsuln und Imperatoren nannten und der vornehmen Herren die
Pompeius,unvermeidliche Rücksicht auf eine kollegialische und ihm persönlich abgeneigte Behörde,schon an sich in seiner Tätigkeit hemmte so steigerte diese
Pompeius,Verkehrtheiten ihr eigenes Gewicht hätte einsetzen können war nirgends vorhanden,selbst war dazu geistig viel zu untergeordnet und viel zu
Pompeius,die erforderliche moralische Autorität gehabt und auch des guten Willens,damit zu unterstützen nicht ermangelt haben allein Pompeius statt ihn
Pompeius,guten Willens Pompeius damit zu unterstützen nicht ermangelt haben allein,statt ihn zum Beistand aufzufordern setzte ihn mit mißtrauischer Eifersucht
Pompeius,in jeder Beziehung unfähigen Bibulus als an Cato Wenn somit,die politische Seite seiner Stellung mit der ihm eigenen Verkehrtheit
Pompeius,und selbst ein Bündnis mit ihnen hätten haben können wenn,nicht unwillig sich geweigert hätte den geforderten Preis die Abtretung
Pompeius,hervorgingen und endlich die Kontingente der Untertanen Wie Caesar hatte,es verschmäht von denselben Infanterie zu requirieren nur zur Küstenbesatzung
Pompeius,gebildeten mehr ansehnlichen als militärisch bedeutenden Nobelgarde und den von,beritten gemachten apulischen Hirtensklaven ausschließlich aus den Zuzügen der Untertanen
Pompeius,teils von ihren Fürsten Sadala und Rhaskuporis herangeführt teils von,in der makedonischen Provinz angeworben waren die kappadokische Reiterei die
Pompeius,Griechenland Vorderasien und Syrien das Ansehen der legitimen Regierung und,oftgefeierte Königs und Völkerklientel vermochte war zum Schutz der römischen
Pompeius,Bewegung gesetzt worden wenn in Italien die Rede ging daß,die Geten Kolcher und Armenier gegen Rom bewaffne wenn im
Pompeius,Segeln Die Stimmung der Soldaten für deren Verpflegung und Sold,genügend sorgte und denen für den Fall des Sieges die
Pompeius,Wege Allein woran schon im März 705 die Verfolgung des,gescheitert war der Mangel an Schiffen drohte auch diese Expedition
Pompeius,erschienen Vielleicht besorgte er daß während des schwierigen illyrischen Marsches,seine gesamte Streitmacht über das Adriatische Meer führen möchte wodurch
Pompeius,wodurch die Rollen auf einmal sich umkehren Caesar in Makedonien,in Italien zu stehen kommen konnte obwohl ein solcher rascher
Pompeius,Armee nachzuführen Ebensowenig gelang ihm selbst die Wegnahme von Dyrrhachion,erfuhr durch einen der Friedensboten Caesars von dessen Vorbereitungen zur
Pompeius,Pompeianischen keine Schlacht anbieten sondern mußte sich glücklich schätzen daß,methodisch zu Werke ging und statt sofort die Schlacht zu
Pompeius,apolloniatischen Küste zu landen und zwang sie an Caesars und,Lager vorbeizufahren und nördlich von Dyrrhachion nach Lissos zu steuern
Pompeius,der ihm entgegengegangen war am rechten Ufer des Apsos aufgenommen,nachdem er vergeblich versucht hatte die Vereinigung der beiden feindlichen
Pompeius,fühlte jetzt sich stark genug eine Schlacht zu liefern aber,ging nicht darauf ein Dagegen gelang es Caesar den Gegner
Pompeius,eine Klippe am Meeresstrand sich ausbreitende Ebene ein Hier nahm,jetzt sein Lager und obwohl die Caesarische Armee ihm den
Pompeius,blieb unternahm Caesar den Höhenkreis zu besetzen der die von,eingenommene Strandebene umschloß um wenigstens die überlegene feindliche Reiterei festzustellen
Pompeius,mit Hilfe der Flotte so leicht ausführbaren Umgehungen zu schützen,griff mehrmals einzelne dieser Verschanzungen an um wo möglich die
Pompeius,da sie auch hier nicht ausreichend Futter fanden Lange konnte,nicht mehr zögern sich durch einen gegen den Feind geführten
Pompeius,einem der alten Lager zum Fluß hingeführten Laufgraben So fand,der den Seinigen zu Hilfe mit fünf Legionen eiligst herbeikam
Pompeius,hatte sie dies nur dem Umstand zu danken daß auch,sich auf dem durchschnittenen Boden nicht frei entwickeln konnte und
Pompeius,der See war er vollständiger verdrängt als je seit des,ältester Sohn Gnaeus Caesars wenige im Hafen von Orikon lagernde
Pompeius,Schlag auszuführen im stande dagegen hing es jetzt nur von,ab gegen den bereits in seinen Subsistenzmitteln sehr gefährdeten Gegner
Pompeius,überzugehen Der Krieg war an einem Wendepunkt angelangt Bisher hatte,allem Anscheine nach das Kriegsspiel ohne eigenen Plan gespielt und
Pompeius,strategisch geschlagen Diese Niederlage hatte zwar nicht diejenige Folge die,nicht ohne Ursache erhoffte zu einer sofortigen völligen Auflösung der
Pompeius,Verfolgung seines Sieges die volle Frucht desselben zu ernten An,war es die Offensive zu ergreifen und er war dazu
