Keyword,LeftContext,RightContext
Pompeius,die Angelegenheiten Roms standen als im Anfang des J 687,zunächst die Führung des Krieges gegen die Piraten mit beinahe
Pompeius,Piso von Rom aus die Aushebungen zu hemmen versuchte welche,Legat Marcus Pomponius kraft des Gabinischen Gesetzes in der Provinz
Pompeius,Menge gegen den Konsul in den gesetzlichen Schranken zu halten,vorübergehend wieder in Rom erschien Als nach vierzig Tagen im
Pompeius,westlichen Becken des Mittelmeers die Schiffahrt überall freigemacht war ging,mit seinen sechzig besten Fahrzeugen weiter in das östliche Meer
Pompeius,ernstlichen Widerstand zu leisten Mehr noch als die Furcht öffnete,wohlberechnete Milde die Tore dieser schwer zugänglichen Seeburgen Seine Vorgänger
Pompeius,an der Westgrenze Kilikiens auf der Höhe von Korakesion Aber,wohlbemannte und mit allem Kriegszeug wohlversehene Schiffe erfochten hier einen
Pompeius,Krieg fortzusetzen und bequemte sich zur Ergebung Neunundvierzig Tage nachdem,in der östlichen See erschienen war Kilikien unterworfen und der
Pompeius,Schiffe und Böte darunter 90 eigentliche Kriegsfahrzeuge wurden teils von,genommen teils ihm ausgeliefert im ganzen sollen an 1300 Piratenfahrzeuge
Pompeius,den Piraten weggeführter zum Teil daheim längst totgeglaubter Individuen durch,ihre Freiheit wiedererlangten Im Sommer 687 drei Monate nach dem
Pompeius,im wesentlichen bereits bewirkte Unterwerfung der Insel zu vollenden als,in den östlichen Gewässern erschien Eine Kollision lag nahe denn
Pompeius,Kollision lag nahe denn nach dem Gabinischen Gesetz erstreckte sich,Kommando konkurrierend mit dem des Metellus auf die ganze langgestreckte
Pompeius,aber nirgends über zwanzig deutsche Meilen breite Insel doch war,so rücksichtsvoll sie keinem seiner Unterbefehlshaber zu überweisen Allein die
Pompeius,hatten ziehen sehen und dagegen die milden Bedingungen vernahmen welche,den ihm sich ergebenden Ortschaften des südlichen Kleinasiens zu stellen
Pompeius,Kleinasiens zu stellen pflegte zogen es vor ihre Gesamtunterwerfung an,einzugeben der sie auch in Pamphylien wo er eben sich
Pompeius,nicht allein das formelle Recht war durchaus auf seiten des,und Metellus im offenbarsten Unrecht wenn er den Vertrag der
Pompeius,im offenbarsten Unrecht wenn er den Vertrag der Städte mit,vollständig ignorierend dieselben als feindliche zu behandeln fortfuhr Vergeblich protestierte
Pompeius,Truppen gekommen war aus Achaia den dort stehenden Unterfeldherrn des,Lucius Sisenna herbei Metellus weder um Octavius noch um Sisenna
Pompeius,darauf wieder friedlich und sogar freundschaftlich nebeneinander im Senate saßen,stand während dieser Vorgänge in Kilikien für das nächste Jahr
Pompeius,ihrem Plan lag sei es was auch behauptet wurde daß,Landung in Kilikien die Könige Mithradates und Tigranes bewog von
Pompeius,Mithradates und Tigranes bewog von weiterem Vorgehen abzustehen Rascher als,selbst es gehofft haben mochte verwirklichte das Manilische Gesetz seine
Pompeius,nach eigenem Gutdünken Krieg Frieden und Bündnis zu machen auf,übertragen Über die Aussicht auf so reiche Ehren und Spolien
Pompeius,Über die Aussicht auf so reiche Ehren und Spolien vergaß,gern die Züchtigung eines übellaunigen und seine sparsamen Lorbeerblätter neidisch
Pompeius,Herr ward so hat dieselbe doch nach der Expedition des,unter allen Wechselfällen und politischen Krisen Roms niemals wieder so
Pompeius,und den mit Lucullus hinsichtlich der Euphratgrenze abgeschlossenen Vertrag mit,erneuerte ja sogar darauf einging mit den Römern gemeinschaftlich gegen
Pompeius,Augenblick gestört wo sie desselben am dringendsten bedurften Zugleich betrieb,die Rüstungen mit Energie Die asiatischen Bundes und Klientelgemeinden wurden
Pompeius,Fahnen zurückzutreten und durch große Versprechungen und den Namen des,ließ ein ansehnlicher Teil derselben in der Tat sich bestimmen
Pompeius,bestimmen dem Rufe zu folgen Die gesamte Streitmacht die unter,Befehlen vereinigt war mochte mit Ausschluß der Hilfsvölker sich auf
Pompeius,40 50000 Mann belaufen 17 Im Frühjahr 688 begab sich,nach Galatien um den Oberbefehl über die Truppen Luculls zu
Pompeius,Amte Ehrengeschenke zu machen und Ländereien zu verteilen so erklärte,alle nach seinem Eintreffen von seinem Amtsvorgänger vollzogenen Handlungen für
Pompeius,einen Versuch Frieden zu erwirken allein von unbedingter Unterwerfung die,forderte wollte er nichts hören was konnte der unglücklichste Feldzug
Pompeius,Erschwerung der Verpflegung nicht geringe Drangsale bereitete Ungeduldig gab endlich,es auf die pontische Armee zu begleiten und ging den
Pompeius,wo aus er mit seinen leichten Truppen das Blachfeld beherrschte,immer noch der kilikischen Legionen entbehrend und ohne sie nicht
Pompeius,es möglich machten nun mit Übermacht die Offensive wiederaufzunehmen ging,wieder vor umschloß das Lager des Königs mit einer Postenkette
Pompeius,zur Nachtzeit in möglichster Stille auf gegen Osten Vorsichtig folgte,durch das unbekannte Land schon näherte der Marsch sich der
Pompeius,bereits nicht mehr Während der ebenerzählten Kämpfe zwischen Mithradates und,war der Partherkönig dem Drängen der Römer und vor allem
Pompeius,Flucht die alte Grenze Kleinasiens den Phasis überschritten hatte stellte,vorläufig seine Verfolgung ein statt aber in das Quellgebiet des
Pompeius,Zeichen der unbedingten Unterwerfung Diadem und Tiara in seine Hände,hocherfreut über den mühelosen Sieg hob den gedemütigten König der
Pompeius,war es von selber vorbei In einem einzigen Feldzuge hatte,die beiden mächtigen Könige von Pontus und Armenien vollständig unterworfen
Pompeius,drei größere Korps unter Quintus Metellus Celer Lucius Flaccus und,selbst auseinander gelegte Heer Aber Celer den der Hauptangriff traf
Pompeius,Aber Celer den der Hauptangriff traf hielt tapfer stand und,selbst verfolgte nachdem er sich des gegen ihn geschickten Haufens
Pompeius,Artokes hielt sich ruhig und versprach Frieden und Freundschaft allein,davon benachrichtigt daß er insgeheim rüste um die Römer bei
Pompeius,Kurbrücke ab und wich unterhandelnd in das innere Land zurück,besetzte die Festungen und folgte den Iberern auf das andere
Pompeius,die der Sieger stellte und sandte seine Kinder als Geiseln,marschierte jetzt seinem früher entworfenen Plane gemäß durch den Sarapanapaß
Pompeius,gehalten und ihn im Osten in unabsehbare Unternehmungen verwickelt hätten,war ein zu erfahrener und zu bedächtiger Offizier um im
Pompeius,jeden Kauffahrer der die Blockade brechen würde Die Landtruppen führte,nicht ohne große Beschwerden durch das kolchische und armenische Gebiet
Pompeius,war das Heer der Barbaren in die Wälder versprengt die,zu umstellen und anzuzünden befahl Die Albaner bequemten sich hierauf
Pompeius,Achäer sogar die fernen Bastarner dem langen Verzeichnis der von,unterworfenen Nationen eingereiht wurden so nahm man dabei offenbar es
Pompeius,Oberhoheit Roms anzuerkennen und als Lehnfürst Zins zu entrichten Allein,weigerte sich dem König eine Stellung zu gewähren in der
Pompeius,am Fuße der Alpen begegnet ward In der Tat während,ohne weiter um die Drohungen des ohnmächtigen Riesen sich zu
Pompeius,König Pharnakes als Belegstück seiner Verdienste und seiner Loyalität an,sandte ward auf dessen Anordnung beigesetzt in den Königsgräbern von
Pompeius,des Großkönigs selbst fast vergessen über Mithradates Tod und bei,feierlichem Einzug zog nichts mehr die Blicke der Menge auf
Pompeius,sondern am Anfang sei blieb den Besiegten wie den Siegern,inzwischen war nachdem er im Jahre 689 mit den Völkern
Pompeius,äußere Unfälle seit langem tatsächlich entglitten waren Den Weg schlug,ein Antiochos der Asiate erhielt auf seine Bitte ihn als
Pompeius,ihn als den angestammten Herrscher Syriens anzuerkennen die Antwort daß,einem Könige der sein Reich weder zu behaupten noch zu
Pompeius,während der Feldzüge im Pontischen Reiche und am Kaukasus hatte,den Angelegenheiten Syriens seine Aufmerksamkeit zugewandt und einzelne Beauftragte und
Pompeius,not tat eingreifen lassen Aulus Gabinius derselbe der als Volkstribun,nach dem Osten gesandt hatte war schon 689 an den
Pompeius,Metellus besetzt worden Bald nachher traf ein anderer Adjutant des,Marcus Scaurus in Judäa ein um die immer neu wieder
Pompeius,wieder daselbst ausbrechenden Fehden beizulegen Auch Lucius Afrianus der während,Expedition nach dem Kaukasus das Kommando über die römischen Truppen
Pompeius,zur Botmäßigkeit gebracht Gegen Ende des J 690 langte dann,selbst in Syrien an 19 und verweilte dort bis zum
Pompeius,meistenteils widerstandslosen Gehorsam Nur die Juden schwankten Die früher von,gesandten Vermittler Gabinius und Scaurus hatten beide wie es heißt
Pompeius,dem Rückweg noch von Aristobulos eine Niederlage erlitt Als aber,in Syrien eintraf kassierte er die Anordnungen seiner Untergebenen und
Pompeius,dem Verhängnis zu erliegen bald schien er im Begriff sich,zu unterwerfen bald die nationale Partei unter den Juden zum
Pompeius,gezogenen Gebieten zu Ende Das von Lucullus begonnene Werk hatte,vollendet die bisher formell selbständigen Staaten Bithynien Pontus und Syrien
Pompeius,syrischen Landschaften als herrenloses Gut zu brandschatzen jedem freistand begann,im J 691 eine Expedition gegen Petra allein aufgehalten durch
Pompeius,Armenische Staat aufrecht standen so willig damals sowohl Lucullus als,ihm den Besitz der Landschaften jenseit des Euphrat zugestanden hatten
Pompeius,seinem Sohne dem Verbündeten und Tochtermann des Partherkönigs gegenüber bei,fand es war eine unmittelbare Beleidigung als bald nachher auf
Pompeius,fand es war eine unmittelbare Beleidigung als bald nachher auf,Befehl der jüngere Tigranes mit seiner Familie zur Haft gebracht
Pompeius,befreundeten Feldherrn für seine Tochter und seinen Schwiegersohn verwandte Aber,blieb hierbei nicht stehen Die Landschaft Korduene auf welche sowohl
Pompeius,auf welche sowohl Phraates als Tigranes Ansprüche erhoben wurde auf,Befehl durch römische Truppen für den letzteren occupiert und die
Pompeius,nur mündlich abgeschlossenen Verträge hinsichtlich der Euphratgrenze zu dringen gab,die zweideutige Antwort daß Roms Gebiet sich so weit erstrecke
Pompeius,verletzender und bedrohlicher war es für die parthische Regierung wenn,von diesem Dynasten die dargebotene Huldigung annahm Nicht minder war
Pompeius,Parthischen Reiches stand mit den Römern offen zu brechen Als,Kommissarien sandte um den Streit zwischen Parthien und Armenien gütlich
Pompeius,Kreta von Metellus begonnene Organisationsgeschäft erhielt den endlichen Abschluß durch,Die bisherige Provinz Asia die Mysien Lydien Phrygien und Karien
Pompeius,um Malatia bis an den Euphrat erweitert hatte und dem,noch teils an der Westgrenze einige von Kilikien abgerissene Bezirke
Pompeius,um Pessinus ansässigen Keltenstammes der Tolistobogier und von Lucullus und,mit den andern kleinen römischen Klienten zur Heerfolge aufgeboten hatte
Pompeius,Trokmerfürst Bogodiatarus wegen seiner im Mithradatischen Kriege bewährten Tüchtigkeit von,mit der ehemals pontischen Grenzstadt Mithradation beschenkt ward der Fürst
Pompeius,des gleichnamigen von Mithradates zu den Römern übergegangenen Feldherrn von,belehnt der Hochpriester des Venasischen Zeus in dem kappadokischen Amt
Pompeius,vorstanden der Erzpriester und Herr des Volkes der Juden dem,nachdem er die Mauern der Hauptstadt und die königlichen Schatz
Pompeius,des hellenisch italischen gewerb und handeltreibenden städtischen Gemeinwesens Lucullus und,sowenig sie auch sonst auf die Nivellierung der Zustände im
Pompeius,Gebäude In gleichem Sinn und in noch größerem Maßstab verfuhr,Schon nach der Überwindung der Piraten hatte er die Gefangenen
Pompeius,billig nach Kriegsrecht zu behandeln Vor allen Dingen aber ließ,es sich angelegen sein in den neuen römischen Provinzen das
Pompeius,dieser Zeit nicht anders gewesen sein Die Zahl der von,in diesen Landschaften neu gegründeten Städte wird einschließlich der kilikischen
Pompeius,Niederlage erlitt das schönste Siegesdenkmal des trophäenreichen Feldherrn Megalopolis nach,Beinamen genannt an der Grenze von Kappadokien und Kleinarmenien das
Pompeius,Anaitis entstandene und bisher dem Hochpriester derselben eigene Ortschaft der,städtische Form und städtisches Recht gab Diopolis früher Kabeira später
Pompeius,ihrer Bewohner in den neuen Mauerring nur in Nikopolis siedelte,die Invaliden und Bejahrten seiner Armee an die es vorzogen
Pompeius,Mazaka später Käsareia jetzt Kaisarieh und sieben andere Ortschaften von,wiederhergestellt und städtisch eingerichtet In Kilikien und Koilesyrien zählte man
Pompeius,städtisch eingerichtet In Kilikien und Koilesyrien zählte man zwanzig von,angelegte Städte In den von den Juden geräumten Distrikten erhob
Pompeius,Juden geräumten Distrikten erhob sich Gadara in der Dekapolis auf,Befehl aus seinen Trümmern und ward die Stadt Seleukis gegründet
Pompeius,auf dem asiatischen Kontinent zur Verfügung stehenden Domaniallandes muß von,für seine neuen Ansiedlungen verwandt worden sein wogegen auf Kreta
Pompeius,neuen Ansiedlungen verwandt worden sein wogegen auf Kreta um das,sich wenig oder gar nicht kümmerte der römische Domanialbesitz ziemlich
Pompeius,sein scheint Nicht minder wie auf Gründung neuer Ortschaften war,darauf bedacht die bestehenden Gemeinden zu ordnen und zu heben
Pompeius,zu Gunsten des Lucullus die lautere Menge zum Preise des,freigebig waren Pompeius namentlich ließ sich feiern und feierte sich
Pompeius,Lucullus die lautere Menge zum Preise des Pompeius freigebig waren,namentlich ließ sich feiern und feierte sich selbst in einer
Pompeius,allzu überschwenglich scheinen Aber die Römer übertrafen diesmal den Griechen,eigene Triumphalinschriften rechneten 12 Millionen unterworfener Seelen und 1538 eroberte
Pompeius,der am 28 und 29 Sept 593 dem sechsundvierzigsten Geburtstag,des Großen durch die Gassen Roms sich bewegte verherrlicht um
Pompeius,das eigentliche Verdienst der Unterwerfung des Ostens Lucullus zukomme und,nur nach dem Osten gegangen sei um Lucullus zu verdrängen
Pompeius,die eigene Stirn zu flechten Beides war vollständig falsch nicht,sondern Glabrio ward nach Asien gesandt um Lucullus abzulösen und
Pompeius,wie wacker auch Lucullus gefochten es war Tatsache daß als,den Oberbefehl übernahm die Römer all ihre früheren Erfolge wiedereingebüßt
Pompeius,in jene Überschwenglichkeiten noch in diese Verkleinerungen einstimmen Lucullus und,haben indem sie Asien unterwarfen und ordneten sich nicht als
Pompeius,Lucullus nicht gemeine Talente und ein an Verwegenheit grenzendes Selbstvertrauen,militärische Einsicht und eine seltene Zurückhaltung wie denn kaum je
Pompeius,einer so vollkommen freien Stellung so vorsichtig aufgetreten ist wie,im Osten Die glänzendsten Aufgaben trugen von allen Seiten sich
Pompeius,stoßen und das Testament Alexanders in Vollzug zu setzen aber,ist weder nach Pantikapäon noch nach Petra weder nach Ktesiphon
Pompeius,Mäßigung hervorgegangen aus dem strengen Einhalten der erteilten Instruktionen wie,vorzugeben pflegte oder auch aus der Einsicht daß Roms Eroberungen
Pompeius,als die Geschichte es dem talentvollsten Offizier erteilt allein wie,war ist seine Zurückhaltung ohne Zweifel einzig das Resultat des
Pompeius,Vorzüge seines Vorgängers Allerdings sind auch von Lucullus wie von,sehr arge Fehler begangen worden Lucullus erntete deren Früchte selbst
Pompeius,indem sein unbesonnenes Verfahren ihm alle Resultate seiner Siege wiederentriß,überließ es seinen Nachfolgern die Folgen seiner falschen Politik gegen
Pompeius,Asiens erwarb Lucullus ein mehr als fürstliches Vermögen und auch,empfing als Lohn für seine Organisation von dem König von
Pompeius,um die Hälfte ihres bisherigen Betrags Freilich litt Asien schwer,legte an Geld und Kleinodien einen Betrag von 15 Mill
Pompeius,Ära beginnen und fast alle ansehnlicheren Binnenstädte des Pontischen Reiches,als ihren Stifter dankbar verehren Die Einrichtung des römischen Asien
Pompeius,dankbar verehren Die Einrichtung des römischen Asien durch Lucullus und,darf bei all ihren unleugbaren Mängeln eine im ganzen verständige
Pompeius,blieb auch im wesentlichen Friede im Orient bis der von,mit der ihm eigenen Zaghaftigkeit nur angedeutete Gedanke die Landschaften
Pompeius,von Alexandreia der römischen Staatseinnahme selbst nach deren Vermehrung durch,noch ungefähr gleich Die argwöhnische Eifersucht der Oligarchie die weder
Pompeius,des gefürchteten Feldherrn verhältnismäßig ruhig entgegen bei dem Bruch zwischen,und der Demokratie dessen Herannahen auch ihnen nicht entging konnten
Pompeius,Demokraten warteten mit peinlicher Angst und suchten während der durch,Abwesenheit noch vergönnten Frist gegen die drohende Explosion eine Contremine
Pompeius,gegen die Aristokratie zu richten schienen ward im stillen gegen,gerüstet und diese Versuche der Demokratie sich der drohenden Militärdiktatur
Pompeius,betrauen und in ihm und seinem Heer ein Gegengewicht gegen,und dessen Armee zu finden Dazu bedurften sie einer Revolution
Pompeius,die zunächst gegen die nominelle Regierung in der Tat gegen,ging als den designierten Monarchen 24 und um diese Revolution
Pompeius,von der Erlassung der Gabinisch Manilischen Gesetze an bis auf,Rückkehr 688 692 66 62 die Verschwörung in Rom in
Pompeius,Der Anschlag der Demokratie der über den Senat hinweg auf,zielte legte eine Ausgleichung zwischen diesen nahe Die Demokratie aber
Pompeius,diesen nahe Die Demokratie aber indem sie der Diktatur des,die eines ihr genehmeren Mannes entgegenzustellen versuchte erkannte genau genommen
Pompeius,um eine imposante Militärmacht auf die Beine zu bringen während,fern am Kaukasus beschäftigt war Hauptleute und Gemeine waren gedungen
Pompeius,daß Crassus und Caesar den Plan entworfen hatten sich während,Abwesenheit der Militärdiktatur zu bemächtigen daß Ägypten zur Basis dieser
Pompeius,beginnen vor allen Dingen aber von Syrien fern zu bleiben,war unbekümmert um solches Geschwätz im Frühjahr 690 aus Armenien
Pompeius,war so war keine Zeit zu verlieren leicht konnte sonst,eher als Caesar in Ägypten stehen Die Verschwörung von 688
Pompeius,Regiments zu bemächtigen die in der Hauptstadt zurückgebliebenen Kinder des,als Geiseln festzunehmen und in Italien und den Provinzen gegen
Pompeius,als Geiseln festzunehmen und in Italien und den Provinzen gegen,zu rüsten Auf die erste Nachricht von dem in der
Pompeius,Kommunikation mit ihm konnte auf dem Seeweg nicht stattfinden da,das Meer beherrschte man zählte dafür auf die Transpadaner die
Pompeius,politischer Achselträger 27 gewohnt bald mit den Demokraten bald mit,bald aus etwas weiterer Ferne mit der Aristokratie zu liebäugeln
Pompeius,Piso es hieß auf Anstiften seines politischen und persönlichen Feindes,in Spanien von seiner einheimischen Eskorte niedergemacht worden 28 Mit
Pompeius,Syriens schritt rasch vorwärts schon waren von Ägypten Aufforderungen an,ergangen daselbst einzurücken und das Land für Rom einzuziehen man
Pompeius,für Rom einzuziehen man mußte fürchten demnächst zu vernehmen daß,selbst das Niltal in Besitz genommen habe Ebenhierdurch mag Caesars
Pompeius,an der Abneigung der Großen und Kleinen irgend etwas gegen,Interesse zu unternehmen Pompeius Heimkehr und damit die warscheinliche Katastrophe
Pompeius,Großen und Kleinen irgend etwas gegen Pompeius Interesse zu unternehmen,Heimkehr und damit die warscheinliche Katastrophe rückten immer näher wie
Pompeius,Stellung verschaffen sollte wie sie infolge der Gabinisch Manilischen Anträge,einnahm Der nominelle Zweck war die Gründung von Kolonien in
Pompeius,nicht gesetzmäßig verwandten Beute welche Anordnungen auf die neuen von,im Osten eröffneten Steuerquellen und auf die in den Händen
Pompeius,Osten eröffneten Steuerquellen und auf die in den Händen des,und der Erben Sullas befindlichen öffentlichen Gelder sich bezog Zur
Pompeius,zu erkennen daß man in diesem Zehnmännerkollegium eine der des,nachgebildete nur etwas weniger militärisch und mehr demokratisch gefärbte Gewalt
Pompeius,um die ägyptische Frage zu entscheiden der Militärgewalt um gegen,zu rüsten die Klausel welche die Wahl eines Abwesenden untersagte
Pompeius,rüsten die Klausel welche die Wahl eines Abwesenden untersagte schloß,aus und die Verminderung der stimmberechtigten Bezirke sowie die Manipulation
Pompeius,mit vollkommener Gleichgültigkeit auf Sie fühlte auch bald heraus daß,einen solchen in jeder Hinsicht ihn verletzenden Beschluß sich nimmermehr
Pompeius,große Menge in Liebe oder in Furcht fortwährend nach zu,hielt und daß jeder Antrag sicher fiel den das Publikum
Pompeius,daß jeder Antrag sicher fiel den das Publikum als gegen,gerichtet errkannte Ermüdet von all diesem vergeblichen Wühlen und resultatlosem
Pompeius,waren denen der Cinnanischen Zeit sehr ähnlich Wenn im Osten,eine Stellung einnahm ungefähr wie damals Sulla so suchten Crassus
Pompeius,eigene Apologien für ihn geschrieben 29 Seit fünf Jahren stand,im Osten an der Spitze seiner Heere und Flotten seit
Pompeius,und die Massen auf ihre Seite hinüberzuziehen Endlich war Gnaeus,durch all diese Kabalen teils gewarnt teils erbittert worden nach
Pompeius,war und nachdem die Demokratie die Bande die sie mit,verknüpften selber so gut wie zerrissen hatte konnte sie nicht
Pompeius,zu erreichen war platt zur Erde gefallen Ihr Verhältnis zu,war so falsch wie kläglich Während sie ihn mit Lobsprüchen
Pompeius,in dieser Angelegenheit unverkennbare Gleichheit ihrer Interessen und derjenigen des,es vermocht diesen Revolutionsversuch niederzuschlagen und damit noch einen letzten
Pompeius,erfechten Inzwischen war König Mithradates gestorben Kleinasien und Syrien geordnet,Heimkehr nach Italien jeden Augenblick zu erwarten Die Entscheidung war
Pompeius,werde er die Schwelle seines Hauses nicht wieder überschreiten Als,nach Erledigung der ihm aufgetragenen Verrichtungen seine Blicke wieder der
Pompeius,verehrten und schon seine begünstigten Freigelassenen wie Prinzen empfingen hatte,den Grund seiner Herrschaft gelegt und zugleich die Schätze das
Pompeius,Nebenbuhler waren in dem Wettlauf nach dem großen Ziel von,überholt aber nicht völlig beseitigt worden Es lag durchaus nicht
Pompeius,Elemente sich verbanden und den neuen Machthaber zu stürzen und,sich gegenüber Quintus Catulus und Marcus Cato mit Marcus Crassus
Pompeius,zunächst wenigstens auf die Parteien in Italien überhaupt noch an,gegenüber und seinem siegreichen Heer Zwanzig Jahre zuvor hatte Sulla
Pompeius,eine der natürlichen Entwickelung der Dinge zuwiderlaufende Restauration durchzusetzen vermocht,Aufgabe war weit minder schwer Er kam zurück nachdem er
Pompeius,der es hätte wagen dürfen die Bürger zum Kampfe gegen,aufzurufen Auch das durfte in Anschlag kommen daß der jetzt
Pompeius,bewaffnen wie noch Cinna und Carbo dies vermocht hatten Wenn,zugriff wie konnte es ihm fehlen eine Staatsumwälzung durchzusetzen die
Pompeius,Entwickelung des römischen Gemeinwesens mit einer gewissen Naturnotwendigkeit vorgezeichnet war,hatte den Moment erfaßt indem er die Mission nach dem
Pompeius,Jahres 691 traf Quintus Metellus Nepos aus dem Lager des,in der Hauptstadt ein und trat auf als Bewerber um
Pompeius,Bewerber um das Tribunal in der ausgesprochenen Absicht als Volktribun,das Konsulat für das Jahr 693 und zunächst durch specieller
Pompeius,zu bezweifeln daß Nepos im direkten oder indirekten Auftrag des,handelte Pompeius Begehren in Italien an der Spitze seiner asiatischen
Pompeius,daß Nepos im direkten oder indirekten Auftrag des Pompeius handelte,Begehren in Italien an der Spitze seiner asiatischen Legionen als
Pompeius,selbst wieder bestimmt durch das damalige Verhältnis der Parteien zu,das sehr eigentümlicher Art war Als Feldherr der Demokratie war
Pompeius,das sehr eigentümlicher Art war Als Feldherr der Demokratie war,nach dem Osten gegangen Er hatte Ursache genug mit Caesar
Pompeius,ein offener Bruch war nicht erfolgt Es ist wahrscheinlich daß,der weit entfernt und mit andern Dingen beschäftigt war überdies
Pompeius,Maulwurfstätigkeit zu ignorieren Dazu kam was bei einem Charakter von,Art sehr ins Gewicht fiel daß die Demokratie den äußeren
Pompeius,wäre auch alles dies nicht gewesen so lag es in,eigenem wohlverstandenen Interesse sich wenigstens äußerlich fortwährend zur Popularpartei zu
Pompeius,halten Demokratie und Monarchie stehen in so enger Wahlverwandtschaft daß,indem er nach der Krone griff kaum anders konnte als
Pompeius,also persönliche und politische Gründe zusammenwirkten um trotz allem Vorgefallenen,und die Führer der Demokratie bei ihrer bisherigen Verbindung festzuhalten
Pompeius,geleitet ward In diese Verhältnisse traf das Auftreten des von,gesandten Emissärs Die Aristokratie betrachtete nicht bloß die Anträge die
Pompeius,Die Aristokratie betrachtete nicht bloß die Anträge die derselbe zu,Gunsten ankündigte als eine Kriegserklärung gegen die bestehende Verfassung sondern
Pompeius,Marcus Cato mit Nepos zugleich zum Volkstribun wählen und wies,wiederholten Versuch sich ihm persönlich zu nähern schroff zurück Es
Pompeius,Gelder zur Rechenschaft zog und die Vollendung des Tempels an,übertrug Es war das ein Meisterzug Catulus baute an dem
Pompeius,begründet und in hohem Maße populär Indem aber zugleich dadurch,die Aussicht eröffnet ward an dieser stolzesten Stelle der ersten
Pompeius,Mann unmöglich fallen lassen konnte auf die ärgerlichste Weise mit,verwickelt Inzwischen hatte Nepos seine Pompeius betreffenden Anträge bei der
